vul,weakness_name,intrusion_action,vendor,product_name
1082,improper restriction of operations within the bounds of a memory buffer,allow remote code execution. note: a different vulnerability than cve-2019-10991.,Advantech,webaccess
1083,out-of-bounds read,allow disclosure of information.,Advantech,webaccess
1084,out-of-bounds write,allow remote code execution.,Advantech,webaccess
1085,null pointer dereference,allow a remote attacker to execute arbitrary code.,Advantech,webaccess
1086,access of uninitialized pointer,lead to an uninitialized pointer and remote code execution.,Phoenix Contact,automationworx software suite
1087,out-of-bounds read,"Lead to an out-of-bounds read, information disclosure, and remote code execution.",Phoenix Contact,automationworx software suite
1088,use after free,lead to a use-after-free and remote code execution.,Phoenix Contact,automationworx software suite
1089,"improper access control , information exposure",cause the controller to restart.,Siemens,"sinamics perfect harmony gh180 with nxg i control mlfb 6sr2, sinamics perfect harmony gh180 with nxg i control mlfb 6sr3, sinamics perfect harmony gh180 with nxg i control mlfb 6sr4, sinamics perfect harmony gh180 with nxg ii control mlfb 6sr2, sinamics perfect harmony gh180 with nxg ii control mlfb 6sr3, sinamics perfect harmony gh180 with nxg ii control mlfb 6sr4, sinamics perfect harmony gh180 with nxg i control mlfb 6sr2 firmware, sinamics perfect harmony gh180 with nxg i control mlfb 6sr3 firmware, sinamics perfect harmony gh180 with nxg i control mlfb 6sr4 firmware, sinamics perfect harmony gh180 with nxg ii control mlfb 6sr2 firmware, sinamics perfect harmony gh180 with nxg ii control mlfb 6sr3 firmware, sinamics perfect harmony gh180 with nxg ii control mlfb 6sr4 firmware"
1090,Stack-based buffer overflow,"allows user-assisted remote attackers to execute arbitrary code via a crafted .csv file, related to a status log message.",SCADA Engine,SCADA Engine BACnet OPC Client
1091,Directory traversal,allows remote attackers to read arbitrary files via a .. (dot dot) in the file_name parameter in an open request.,Ecava,IntegraXor
1092,Directory traversal,allows remote authenticated administrators to read arbitrary files,IntelliCom,"WebSCADA WS100 and WS200, Easy Connect EC150, Modbus RTU - TCP Gateway MB100, and Serial Ethernet Server SS100"
1093,Stack-based buffer overflow,allows remote attackers to execute arbitrary code via a long string in the second argument.,Ecava,IntegraXor
1094,Stack-based buffer overflow,allows remote attackers to cause a denial of service (crash) and execute arbitrary code via a crafted 0x02 opcode to TCP port 46823.,Sielco Sistemi,Winlog Pro
1095,Heap-based buffer overflow,allows remote attackers to execute arbitrary code via a long request to TCP port 777.,WellinTech,KingView
1096,,allows remote attackers to cause a denial of service (application crash) or possibly execute arbitrary code via a crafted web site.,Unitronics,UniOPC
1097,use-after-free,allows remote attackers to execute arbitrary code via a crafted html document.,Honeywell,ScanServer ActiveX Control
1098,cross-site scripting (xss),allow remote attackers to inject arbitrary web script or html via unspecified vectors.,Ecava,IntegraXor
1099,stack-based buffer overflow,allows remote attackers to execute arbitrary code via a long second argument to the validateuser method.,WellinTech,KingView